Title,User Reviews
Fast X,"['Excruciatingly Awful', 'What Happened?', 'The worst one yet.', 'Fast X', 'I literally thought this was a parody skit off of SNL!', 'They need to stop', 'its comically bad', 'When ""Avengers"" meets ""Fast and the furious"" everything goes wrong', 'Toretto just started playing Rocket League in the middle of Italy.', 'Jason Momoa gives one of the most embarrassing performances in film history', 'Void In between car action', ""Can't wait for the franchise to be over!"", 'Because... Family', ""They couldn't even put the effort into a better title"", 'Total disrespect for the fans', 'Absolute piece of crap that not even ends!!!', 'Weak fantasy with cars', 'The most entertaining part of this movie are the ChatGPT 10/10 reviews', 'What the heck', 'How bad!', 'The end of the road begins badly', 'Left me furious', 'I miss the old Fast and Furious', ""Even for F + F, it's a Mess"", 'This keeps getting worst and worst.']"
Love Lies Bleeding,"['Refreshing take on action thriller', 'A pulsating romance thriller']"
The Killer,"['Definitely an interesting and suspenseful movie, but lacking in the brilliance I had hoped for...', 'Great looking, but dull as dishwater.', 'Plot-Lovers Will Need To Look Elsewhere', 'Average', '""If you are unable to endure boredom, this work is not for you.""', ""Boring movie that's more style over substance"", 'Incredibly slow, predictable and nothing out of the ordinary.', ""It's...fine?"", 'Yeah, nah.', 'Empathy is Weakness', 'Vacuous and unnecessary', 'Portrait of a psychopath.', 'Just bore them to death', 'Dreary', ""Something 's missing"", ""An assassin you've not seen before from a great director."", 'Overrated', 'Another winner from Fincher', 'As Fun as Riding an Escalator', 'Slick, Smart, and Slim', 'Empty', 'more cowbell, less narration', 'Yawn. Blood. Yawn. Gore. Yawn.', 'Completely Underwhelming, Slick Production Foiled by Weak Story', 'A unique thriller to say the least']"
The Blues Brothers,"[""They're On A Mission..."", ""It's all about the blues."", 'One of my Favourite Movies', ""Plot...What Plot...I Just Don't Care"", ""Don't you miss comedies like this?"", ""Utterly ridiculous... but, that's the whole point."", ""Someone found the fountain of youth and doused this baby in it, 'cause it sure ain't getting old"", ""Quite possibly John Landis's best film"", 'Why Did I Take So Long To Watch This?', 'A classic', 'Nitro and Glycerin', 'A true classic, comedy the way it should be - FUNNY', ""It's all real"", 'NO other movie like it has ever been made! A Permanent CLASSIC!', ""The Blue Brothers at God's service against Cops and neo-Nazi!!!"", 'Why the hell is ""THE BLUES BROTHERS"" not in \'The Top 250?\'', 'had me smile almost all the time', 'One and only - The Blues Brothers', ""A great musical for people who don't like musicals!"", 'Wild ""musical comedy"" offers long-lasting fun and excitement.', '""We\'re on a mission from God""', 'A critique of the criticisms', 'A Wild & Crazy Ride', 'An Eccentric Cult Classic', 'Blame it all on the penguin.']"
The A-Team,"['If you run out of blockbusters, check it out.', 'Face, you have nothing to worry about', 'Fun , entertainment , comedy and noisy action with the nostalgic team', 'we need a sequel, this movie survived the time test, is a joy to watch even after all those years', 'The best film you could ask for from an ""A-Team"" adaptation', 'I LOVE IT WHEN A MOVIE COMES TOGETHER', 'A+Team', 'Overblown, super-exaggerated trash... and I loved every minute', ""A solidly entertaining action movie, just don't think too hard about plausibility."", ""Pity the fool who doesn't enjoy this film"", 'The C-Team', 'Bang', 'Ridiculous action gets tiresome', 'The A-Team in 1,000 words: overkill is underrated', 'The Definition of Dumb Summer Fun', ""It is too bad it wasn't successful enough to warrrant a sequel"", 'The A-Team: a very good B-movie', 'Missing The Goofball Charm', 'A film well worth watching', ""An enjoyable reboot of a classic '80s TV series"", 'I love it when a plan comes together! A Simple, short review.', 'The A-Team', '4 charasmatic leads with good chemistry in service of a noisy, bloated mess of a movie.', 'More like the D-team', 'Fool, why we flying a falling tank?']"
Kingsman: The Golden Circle,"[""This Circle is not quite golden, but it doesn't collapse"", 'Long, Boring and Overrated', 'SILLY SEQUEL: Here are the 10 Top Reasons to watch this crap:', 'Fun, but feels like the fifth film in a franchise struggling to maintain its relevancy, not the follow-up to what was perhaps the most promising new property in Hollywood.', 'Matthew makeths a mess.', 'Great cast, pretty awful movie', 'More satirical spy action hijinks...', 'a hyperbolic, brand-advertising and inordinately smug hotchpotch of a half-baked cash cow', 'Too much CGI and annoying jokes', 'Entertaining, but never quite reaches the heights of its predecessor', 'What a disappointment', 'Not As Good As The Original But Still Entertaining', 'Foul Witless Trivial Overblown Dumb Boring Rot And Piffal', 'Takes The Low Road', ""Doesn't get any worse"", 'A solid follow-up to the 2015 film', 'Lame, Forced comedy fills this instantly forgettable sequel', 'such a bummer!', 'Kingsman The Golden Circle: How is this stuff so good?', 'Lesser sequel', 'I feel like a tornado in a trailer park.', 'Overlong, over flashy CGI driven nonsense', 'Rubbish!!', 'A feel good comedy spy film with lots of adventures', 'Kingsman: The Golden Circle']"
The Bad Guys,"['Rather enjoyable...', ""Surprisingly, It's Not That Bad, Guys"", 'One of the best animated experiences', 'Fun for the entire fam.', 'An animation gem!', 'The Bad Guys taught us one thing; never judge a film by its trailer/poster.', ""Deserves to Be Dreamworks' Next Big Franchise."", 'Fun, character driven movie that works, even if some faults are definitely there', 'Better than Cake', 'Surprisingly good', 'The Bad Guys is good!', 'actually one of...', 'An overnight viral sensation...', 'A Return to Form from DreamWorks!', 'The Style Was So 😫😍', 'Fun, action, laughs, and lots of crime film homages', 'Great animated movie', 'Not Bad for Bad Guys', 'I knew you were good', 'Very fun', ""LISTEN to ME! I'm a 51 year old male and.."", 'Predictable/cliche but watchable.', 'Not bad... get it?', ""The bad guys robbed the box office am I best bad guy you know what I'm saying"", 'I love this film, and a great family film.']"
Game Night,"['Mainstream comedy done right', 'Movie Review: Game Night', ""Better and funnier than we thought it would be. Let's do Game Night!"", 'Winning Comedy', 'A classic comedy thriller with brilliant dialogue and memorable characters.', 'More Entertaining Than The Average Board Game', 'This movie plays its cards right!', 'Funny, funny movie. Rachel McAdams is GREAT!', 'a small surprise', 'A legitimately hilarious comedy with surprisingly strong peripherals and plot, Game Night is way too much fun to not love', 'A vulgar, violent, solidly R-rated comedy that is nevertheless sophisticated rather than gross.', ""We Couldn't Stop Laughing"", 'Surprisingly funny', 'Game set and match.', 'Fun film', 'An amusing adults-only comedy, but no game changer.', 'Fun, at times genuinely funny, and always entertaining.', ""Don't listen to some of these bad reviews...it was a pretty good comedy"", '""Game Night"" is a Winner!', 'Hilarious, stupid, and a lot of fun.', 'Jason Bateman Shines', 'I Do Love A Good ""Game Night""?', ""A night of games one doesn't want to miss"", 'Funny With a Hint of Unpredictability', 'Hilarious to watch again and again!']"
Enola Holmes,"['For fans of Millie Bobby Brown', 'Not for Sherlock Holmes fans, but not bad either.', 'A cute little movie', 'Perfect for a 15 yro girl', 'Am I the only man who love this movie?', 'It could have been so much more...', 'Fun, sweet and uplifting', 'Oh the irony......', 'Not the Target Audience', 'A charming film - good for the whole family!', 'A Bit Lost', ""Millie Bobby Brown solves a dull mystery in Netflix's disappointing Enola Holmes"", 'family entertainment', ""It's good family fun, not to be taken seriously."", 'Teen Version of the Guy Ritchie genre', 'Please make a sequel', 'A fast-paced but forgettable addition to the Sherlock cannon', 'Millie as Enola', ""I'm a woman"", 'Not one for purists', 'A bit boring', 'Enola Holmes', '""Fun for the family (not for the fandom).""', 'Breaking The Fourth Wall and Feminism', 'This should be rated higher!']"
DC League of Super-Pets,"['Sure To Be A Fan Favorite - Full Of Classic Crime Fighting Battles As Well As Heartfelt Messages', 'I recently turned 30 a few days ago and I really enjoyed League of Super-Pets', 'I think adults will like it too', ""Keeping in mind it's not for adults, its a great children's film."", 'Surprisingly competent and charming', 'Multi-Paws', 'A lot of fun!', 'Superpets Review: Such a Surprise', 'A fun movie to watch.', ""Family's Best Friend For Fun Movie Going"", 'What You Would Expect.', 'This is how to do the DCU', 'Fun and cute', 'One of the Best DC Films Ever', 'The Secret lives of Pets gets mixed in the DC Universe', 'Funny as hell', 'Pets Taking Over For The Heroes', 'Fun for adults as well as kids!', ""I'm not so sure that a guinea pig could make anyone a . . ."", 'So much love for Super-Pets!!!', 'Weak', 'Fun film and a great time!', 'dc stirk again!!', 'The Krypto movie that needed to be made', ""Big laughs, big fun, and lots of heart, a poor man's Secret Life of Pets this is not.""]"
Now You See Me 2,"[""Can't find the wow factor"", 'Big giant mess!', 'What a mess', '4/10', 'A Caricature of a Movie', ""Disappears from your mind as soon as it's over"", 'In terms of plot, this is a complete mess', 'Unbelievable — And Not In A Good Way', 'Miss the ""magic"" of the first, but still entertaining', 'A very good sequel full of twists and fun', 'There Are Cheaper Ways to get some sleep', 'Disappointing', 'Plastic fantastic - boring and unbelievable', 'Love it!', ""Reviews are fake, big names don't help a bad movie"", '""We are going out with a show people will never forget.""', 'Throws Out All Logic and Realism', 'Autistic Reviewers Opinion Of This Movie.', 'Not as good as the first one but good enough', 'Dull, cheap and no where near the prequel', 'Spoiler-free review', 'Inarticulate', 'Now You See Me 2', 'Now You See Me 2 - Review: Cash Grab', 'NYSM2 is a literal and fatal misdirection with little in the way of fresh excitement.']"
The Brothers Grimsby,"['Hardcore comedy for adults.', 'Sickening, Depraved, Disgusting and ... Hilarious!', 'mix bag of outrageous humor', 'Puerile comedy slapstick - I loved it!', 'The man knows funny', 'Non-stop gags...', 'Either Raises Or Lowers The Bar On Filth', 'There are some scenes in this movie I can never un-see. That being said...I really really enjoyed this and recommend it.', ""Liam Gallagher's best role to date!"", 'Grimsby Is A Funny One!', 'Incredibly Raunchy & Silly Yet I Laughed at Times', 'Not laughed so much at the cinema since the parole officer', 'Love it or hate it', 'A spy satire with game-style story', 'Taking grossness to new depths', 'So grim its good', 'There\'s nothing grim about ""Grimsby""', 'The funniest move of the year killed by bad marketing and poor studio choices', ""First you'll rub your eyes, then you'll need to wash them"", 'What happens when a once-brave comedian conforms to mainstream standards', ""It's bonkers."", 'Clumsy, rude and funny', 'Yes very stupid and very funny.', 'Atrocious in Every Way', 'Excellent gut busting humor sensitive folks stick to PG or PC']"
Fast & Furious 6,"['Fast & Furious 6 is The best film in the franchise that I love to Death!', 'Builds Upon The Winning Blockbuster Formula Of Fast Five.', '""This is vehicular warfare.""', 'BEASTLY', ""Hail, hail the gang's all here - but now minus one"", 'Fast & Furious 6', 'Brainless and Overrated, with the Longest Take-off Strip of the World', 'Pretty ace film!', 'A big movie and a fun time!', ""Movin' on up!"", ""Indeed a guy's movie..."", 'Bold imagination and beautiful execution of some of the most exhilarating car chases ever done on film make this the unequivocal franchise best thus far', ""I don't get how this and the previous installment were so well received. They're utterly stupid."", 'Pure Entertainment', 'Fast Cars, Tanks and Planes Oh My', 'Incredible! Thoroughly enjoyable!', 'A whole new stratosphere of action, ""F&F6"" will start to separate the junkies from those who need substance', 'Physics defying and entertaining', 'Amazingly faster and more furious than ever', 'Thrill ride par excellence', ""Action Franchise Isn't Out of Gas Yet"", ""Idle 'Furious' needs a tuneup"", 'Number 6 is a Winner', 'In life Speed and Family are the two best things', 'It was ok.']"
Elektra,"[""OK, I'll confess, this movie is definitely junk food for the mind, like eating a twinkie - but it is fun to watch"", 'Small Movie with a Big Heart\x85\x85Highly Underrated', 'Flawed but fun', 'Underrated', 'I thought it was decent', 'a well made action movie with an air of mystique', 'A loner assassin faces off supernatural warriors with impressive fights and breathtaking action', 'The star, Jennifer Garner, makes it worthwhile', 'The Luscious Lady In Red', 'Nothing of any value here \x96 pretty much a template for how to make a bad action/superhero movie', 'An insanely fun and enticing movie', 'It was very INTENSE!', ""A superb but 'difficult' comic book film"", 'Jennifer Garner Is Spectacular As Elektra, And Bob Sapp Rules, Too!', 'Better than I expected', 'A Second Life, a Second Chance', 'Great Entertaining Film', 'What a Mess', ""A poor man's DareDevil!"", ""A Boy's Ponderous Take on Girl Power"", 'A weak vehicle', 'not the Electra I know...', 'A special-effects extravaganza. It lacks story and character development, but is visually stunning with a surreal atmosphere and terrific action sequences. Thumbs up!', 'Everyone looks pained', 'Some What an OK Film']"
Charlie's Angels,"['Eye Candy No-Brainer Fun To Watch', ""It's fun!"", 'Music video entertainment', 'High-spirited, infectious ridiculousness', 'Golden Turkey awards nomination', ""Silly, but quite enjoyable if you're in the mood."", 'Charlie would approve.', '""Angels we conclude our broadcast day""', 'Solid fun', 'Simply brilliantly silly and fun and makes me smile every time I watch it.', 'The Chad', 'Just Plain Fun !', 'Enjoyable movie that is also a little silly', 'Fun movie based on the 1970s show', 'The angels have fallen (big time)', 'Entertaining Fluff', ""It's hard not to like the girls"", 'Ravishing and lethal detectives rescue stolen software.', ""Annoying music video. Girl power? Don't make me laugh (or cry)."", 'An enjoyable piece of fluff', ""Charlie's Angels"", 'A slick, enjoyable fast paced and hilarious action movie', 'Shame on you McG', 'Good cheesy fun']"
Enola Holmes 2,"[""Continues the character's story in the same light-hearted manner as the previous film"", 'Fun fun fun', 'An intriguing adventure, still missing a little something.', 'Netflix did it again...', 'Just ordinary, nothing extra', 'Great sequel...!', 'An enjoyable sequel that is as much fun as the original', 'I thoroughly enjoyed this caper', 'Strikes a Chord...', 'Second verse, same as the first', 'Another enjoyable Enola tale!', '2 years later', 'About on par with the original', 'I love Enola', 'A new investigation for Elona Holmes.', 'Awkward socio-political cringe', 'They forgot the concept of the stories...', 'Boring and Mediocre', 'Great film', 'keep them coming', 'More Adventure And fun', 'Enola Holmes 2 surpasses the original!', 'Enola is back', 'A thrilling and triumphant sequel', 'Millie Does Her Usual Good Job of transfixing The Viewer And Keeping The Entertained!']"
The Girl in the Spider's Web,"[""Enjoyable while you're watching it, but much of it makes no sense"", 'turning into Bond', 'Still good, just not as good as...', 'A Bit of a Mess', 'How did I hate this movie? Let me count the ways.', 'Monumentally stupid.', 'The girl in the boring web', 'Watchable but shallow spin-off', 'Are you not Lisbeth Salander, the righter of wrongs? The Girl with the Dragon Tattoo?', 'Are you Lisbeth Salander the... Action hero?', ""A tangled spider's web"", 'THE GIRL IN THE MEH MOVIE', 'Claire Foy is not Lisbeth Salander', 'Not quite of Swedish quality', 'Just a standard action movie...', 'Really awful, derivative movie about a SJW superhero', 'Visually entertaining with its direction but lacking in plot and its darker tone from Dragon Tattoo movie.', 'The story is just so, so, oh so very predictable!', 'An insult to the Millennium series', 'Another American miss', 'Awful movie!', 'Disappointed', 'Get stuck', 'Enough already', 'Not bad']"
Inferno,"['The third, and worst, of the Langdon-Hanks-Brown-Howard films', 'Dazzled and confused', 'I pity anyone who paid cinema prices for this absurd turkey', 'When ""National Treasure"" is the better movie', 'This was like a bad TV version of The Da Vinci Code', 'Production interference ruined ending', '*', 'Empty calories, mainly due to poor direction', 'Disappointing and Predictable Story', 'Messy, weak and lacking the serious impact of a serious crisis.', 'A Wasted Opportunity', 'A career-low for all involved', 'Why would they change the ending? That was the best part of the book... WHY?', ""Don't watch if you read the book..."", 'Sadly disappointing, a hollow remnant of the franchise . . .', 'Good example of bad production', 'All Those Good People / Story / Money / & A $5 Story Adaptation', 'Turkey of the year', 'Mystery thriller set in Florence , Venice and Istanbul ; plenty of suspense , twists and turns', 'Good but forgettable (reading the book vs not).', 'Disappointed with the changed ending', 'Very long waste of time', ""Ron Howard's Inferno."", 'Total Disappointment']"
The Counselor,"['Expectations', 'Drowns under the weight of cryptic dialogue and abstract storytelling.', ""Perhaps Scott's most underrated film."", 'Who Should Be The One Counseling?', 'one of the greatest morality plays of all time...', ""I'm not a contrarian, but"", 'The Counselor is so in love with itself that it gives no one else a reason to love it, let alone care.', ""I can't believe a crime thriller can be so boring"", 'Be your own judge.', 'Wow', 'Stop it Cormac! Ridley and Cameron how could you?', 'characters with no compelling interest', 'Poorly-scripted drug trafficking drama', 'Convoluted does not equal Complex', 'Counseling the Counselor', 'Disappointing neo-noir from Ridley Scott and Cormac McCarthy', 'The Counselor: A Shakespearean tragedy of greed and desperation.', 'Disappointing is such a limited word...', 'A new level of sinister', 'The Counselor proves that talented people can produce a horrendous mess', 'Evil At Its Most Audacious!!!', 'Might of the Monologues', 'A dark, bleak masterpiece about predators - 10/10', 'A dead boring first hour and an impressive ending', 'Absolutely brilliant!']"
Austin Powers in Goldmember,"['whacked-out comedy with a lot of laughs', 'Tight like a tiger', 'The weakest of the series, but Myers still has his mojo', ""Austin's Anatomy"", 'About as good as the second', 'Everything you loved, and more', 'The gold is a little tarnished', 'Still A Good Time Waster', 'He Loves Only Gold', 'Austin Powers/Mike Meyers is back along with some hilarious new characters', 'Wildly hit-or-miss', 'Tarnished ""Goldmember"" Still Shines', 'I LIKE GOOOOOOOOLD....member.', 'Myers does an excellent job as different characters', 'Still Retains Most Of The Humour, But Somehow Contains Less Content', ""Third time's not Golden, baby"", 'Goldmember = Pretty Good!', 'OK- but the worst out of the three', 'Another great spoof movie', 'A buffoonery on ""Goldfinger""!', 'Crazy plot', 'my notes', 'GOLDMEMBER!!', 'Funny', 'Myers is a genius']"
Austin Powers: The Spy Who Shagged Me,"[""Yeah, Baby!!! This is one of the funniest friggin' movies of all time"", 'Mr. Mojo rising', 'Slightly better than the first', 'A WONDERFUL SEQUEL', 'Recycles old humor, but still fun...', 'Better than the first one!', 'More inevitable cheekiness from Myers', 'Austin Powers: The Spy Who Shagged Me', 'A Hilarious Time-Waster', 'Will Film Buffs Like This ? ...', 'More Scott and Dr. Evil!', 'The Man With The Golden Pun', 'One of the funniest sequels ever made', 'Superior sequel', 'mostly good, but one scene was unnecessary', ""Funny But Nasty 'R-Rated' Look At The Stupid '60s"", 'An inferior sequel, more successful, but lacking the dry wit of its predecessor.', 'Still funny but a lot of recycled gags from the first film', '""Do you smoke after sex?"" ""I don\'t know. I\'ve never looked""', ""It's shagadelic baby"", '""Austin Powers: The Spy Who Shagged Me"" is light-hearted entertainment which supplied me with a ton of laughs!', ""uggghhhh.... so how is this funny? It's depressing!"", 'The funniest jokes of the 1990s', 'Another funny entry in the series, actually my favorite.', 'HILARIOUS!']"
Point Break,"['Impressive action sequences let down by almost everything else.', 'No dead presidents', 'Excellent cinematography-fun remake!', 'Extreme Sports=Extreme Dud', 'GoPro and Red Bull decide to make a film', 'Watch the original one instead', ""Nonsensical plot accompanied by visual splendor of world's most extreme corners."", 'Point Broken', 'Worst remake EVER!', ""It's almost as though they made a terrible movie on purpose."", 'Pointless Break', 'Pointless Retreads', 'Such a terrible film', 'Disappointing', 'Craptacular', 'A dire and far to serious remake', '1/10 -- BEWARE OF GARBAGE!', ""It's a black eye to the fans of the original who might have given this disaster a chance"", ""Pointless and hollow, the budget's been expanded while the personality and energy is gone"", 'Probably the worst remake ever', 'This is an awful movie and is a disgrace to the original.', 'Terrible Crappy Remake of an Awesome Classic Film', 'Story-wise this is just a mediocre movie, but the stunts and scenery make the 1 hour and 45 minutes worth the watch for those of us who enjoy that sort of thing.', 'Horrible Movie', 'Empty']"
Batman: Mask of the Phantasm,"['Awesomeness!', 'INTELLIGENT AND MATURE BATMAN CARTOON', 'Batman: Mask of the Underrated Classic', 'The Greatest of all the animated Batman films!', ""Along with Tim Burton's Batman Returns the best Batman movie to date."", 'like a brilliant four-part episode from the series; lots of personal wounds revealed, and the Joker to boot!', 'If you liked the first two Batman movies this is a DEFINITE must see', 'The first great animated Batman movie.', 'You walk the edge of that abyss every night.', 'In Blackest Night', 'My favorite Batman movie', ""The Way Batman's Origin was meant to be told"", 'Measures up', 'An absolute classic, the best Batman movie so far', 'Aww yeah--one of the best.', 'Amazing Batman movie', ""The Best Romantic Film I've Ever Seen"", 'The Most Absolute Batman Animated Movie Of All Time', 'Still classic', '""There are certain advantages to having a sturdy cranium, Master Bruce.""', 'Best portrayal of the Dark Knight.', 'Very well made, mature and entertaining', ""Batman Mask of the Phantasm: Don't see the appeal"", 'The Best Batman Movie of All Time', 'Great as the animated series.']"
It's a Mad Mad Mad Mad World,"['A King With a Hundred Jesters', 'Greatest comedy of all time, period.', 'More than the sum of its parts', ""Yes, It's Loud But It's An Incredible Comedy Classic"", 'A Comedy Classic that Still Holds Up...', 'Just push the button marked BOOZE!', '""So come on. Let\'s have one big adventure!""', 'Classic epic comedy with too much editing', 'An Epic Comedy', 'Personifies everything I hate in movies yet oh how I laughed.', 'While very, very long, it still manages to be one of the funniest and most quotable comedies ever', 'Every comic from practically every part of the world gets to take their lumps here.', ""It's every man (and old bag) for himself."", 'The funniest movie of all time', 'Every Man And Merman For Himself', '""We\'re going to have to kill him!"" Arnold Stang.', ""A classic you'll never get tired of watching"", 'Mad x 4 World = BIG W = WONDERFUL. Simply priceless.', 'All those comedians causing all the damage', ""It's a Funny, Funny, Funny, Funny Movie"", 'funny even when you know it by heart', 'its a great great great film', 'This Movie IS A Treasure!!! : )', 'The greatest comedy ever made; period.', ""It's A Bad, Bad, Bad, Bad Movie""]"
S.W.A.T.,"['Underrated', 'Good action film', 'Average good action film', ""Good for what it is but some aspects are really let down by the fact it's aimed at twelve year olds."", 'Average action movie - nothing more nothing less', 'For action fans', ""'Die Hard' continues to influence to this day..."", 'A walking cliché?', 'One of the better tv-series-to-big-screen-adaptations', 'A better title might be So-WAT?', 'Run of the mil action film', 'Good action movie, but not enough Michelle Rodriguez.', 'Another film with a good concept but never delivers', 'average... unrealistic...', 'S.W.A.T. a load of rubbish', 'Swaggering Action Film Is Violent, but Fun!', ""Just about what you'd expect"", 'Perfect popcorn movie', 'Good popcorn fun in this big screen rendition of the mid-seventies TV series', 'Sealed with a Frisk', 'Run of the mill, and not exciting at that.', ""8 1/2 out of 10 - That's good."", 'Watchable big budget Hollywood action, passes the time I suppose.', 'Utterly Routine', 'Simple and fun']"
