Title,User Reviews
Forrest Gump,"[""Let's see the world through the eyes of Forrest Gump"", 'Pure Charm', 'In my opinion, no film has touched me more than this one.....', 'Dropping My Keys', 'The role of innocence in positive thinking and thus success ...', 'A beautiful fable for now and the future', 'a box of chocolate', ""Thirty years on, and it's still as wonderful."", ""Forrest Gump is a movie masterpiece that won't be forgotten and will continue to inspire"", 'Purity and innocence retained', 'Contemporary classic: one of my all-time faves', 'Encapsulating...', 'Tom Hanks delivers an astounding performance as Forrest Gump.', 'Beautiful film', 'Mama said ...', 'Quite possibly the best movie ever made.', 'The Hand Of An Unseen Providence', ""One of the best films of the 90's"", ""Life is like a box of chocolates. You never truly know what you're gonna get. Forrest Gump is amazing!"", 'why such a low rating???', 'The zen of Forrest Gump.', ""Life's Lessons in one Movie..."", 'After 20 years, I still love Forrest Gump!', '""I just felt like running"".', 'You need to watch it again and again.']"
Fight Club,"['A great movie you can watch again and again', 'Superb', 'Crazy, Cult, Plot Twist, Awesome = Fight Club', ""Fincher's tour de force is a bruising assault on the senses"", 'Delightful Romantic comedy', 'Welcome to movie heaven!', ""It's one of the best."", 'We should actually talk about the Fight Club', 'Crazy good', 'An unpredictable movie.', 'This is why we watch movies.', 'You love it or you hate it, personally I loved it', 'The things you own end up owning you.', 'Go in completely blind', ""HOW THIS IS NOT EVERYONE'S FAVORITE MOVIE IS BESIDE ME"", ""It's Hard to Take Your Eyes Away"", 'Watch it atleast twice', 'I study philosophy but this film took me for a ride', 'Not about fighting', 'a dangerously brilliant film that entertains as well as enlightens.', 'My first review about my favorite movie...', 'This is a very important movie.', 'Life-changing Fight Club', 'A unique film', 'The first rule of Fight Club: You never talk about how over-hyped Fight Club is']"
The Lord of the Rings: The Two Towers,"['An Epic in every sense of the word.', '""There\'s some good in this world Mr. Frodo, and it\'s worth fighting for.""', 'Great movie', 'Absolutely, totally fantastic!', 'They Accomplished the Near-Impossible.', 'Sophomore effort shines as brightly as the first.', 'A magical film.', 'My personal favourite of the trilogy', 'A standing ovation for all concerned.', 'One of The Best battle sequence.', ""Helm's Deep could be the greatest battle sequence of all time."", 'My precious...', 'My Visit To The Cinema', 'A True Fantasy Movie', 'Magnificent epic', 'Jackson remains a genius, and this series remains a masterpiece--Faithful enough to Tolkein, and a fantastic movie!', 'Hail The Heroes!', 'Fantasy greatness with one of the best sieges put on film', 'The Two Towers! What Is It? The Answer Is: My Precious!', 'Tough to put on film but came out very well', 'The Sequel That Dwarfs Its Predecessor...', 'The battle for Middle Earth is about to begin...', 'The Greatest of the Three Rings', ""FilmCreature Reviews 'The Lord of the Rings: The Two Towers'"", 'If there was a spotlight for all time movie reviews it would be this trilogy-to-be-one film']"
Inception,"['A one-of-a-kind mind-blowing masterpiece!', 'Is it possible the makers understand how incredible this film is?', 'Inception was only less shocking to me than the Matrix', 'Answering all the questions with one answer: I feel guilt. ⭐', 'Insanely Brilliant ! Nolan has outdone himself !!', 'Generation defining.', 'In a Decade, ""Inception"" May Be A Religion', 'Mindcraft...', 'My number one favorite movie', 'Wait', 'Amazingly original...but also a bit overwhelming.', 'Sci-fi perfection. A truly mesmerizing film.', ""Didn't win Best Picture? WHAT?"", 'This is your first lesson in shared dreaming. Stay calm.', 'Matrix but in dreamworld? Nah.', 'Incredible-Nolan keeps improving and Inception is by far the best improvement!', 'Nolan at his most intelligent best.', 'The perfect summer blockbuster?', 'Come Back Again!', 'All right.....', ""A Potpourri of Vestiges Review: Buñuel meets Kubrick in Nolan's most ambitious venture, till date"", ""Inception; Christopher Nolan's masterpiece?"", 'So much less intelligent than it seems', 'Good idea lost in the noise', 'Inception? More Like Insipid']"
Star Wars: Episode V - The Empire Strikes Back,"['All the fun of the original with a much better, darker plot', 'Excellent timeless classic, the best sequel of all time!', 'I enjoy this one more than A New Hope', 'One for All & All for One...', 'A worthy second (or 5th??) Star Wars installment, might be the best of the bunch.', 'One of the best films ever made.', 'Best Star Wars FILM', ""It's NOT the darkest of the trilogy - it's the most mature"", ""Even though he wasn't at the director's helm this time, George Lucas has done it again."", ""finest of the trilogy because Lucas didn't write the script"", 'Manages to be even better than New Hope, and that was just as brilliant', 'The best ""Star Wars"" film ever made.', 'This is among the all time great science fiction movies that is an absolute must see', 'Fantastic Sequel', 'The best movie of all Star wars', 'Darker and better than ""New hope""', 'The best film in the original trilogy.', 'Outstanding follow up.', '""It is your destiny""', 'Star Wars: Episode V - The Empire Strikes Back', ""Why can't they make them like this any more?"", 'Greatest Movie Ever', 'One of the best movies of all!', 'Masterpiece', 'Star Wars Episode 5 Empire Strike Back']"
The Matrix,"['Just wow', 'Ah yes. My first existential crisis.', 'Benchmark forever.', 'The timeless classic.', ""Agent Smith: Human beings are a disease, a cancer of this planet. You're a plague and we are the cure."", 'A watershed moment in film-making – and what a kick-ass masterpiece', 'One of the best action sci fi action movies of all time!', 'a masterpiece', 'Immensely entertaining, intriguingly philosophical and just about one of the best films ever made!', 'The Matrix Is one of the best Classic Sci-Fi Action Film ever', 'A sci-fi action thriller milestone', 'One of my favorites', 'So well written that makes you questioning the reality. ⭐', ""20 years on from release, some random thoughts on revisiting The Matrix. Spoiler: It's still brilliant."", 'Still hip as heck even after 20 years', 'Exhilarating 4DX profound experience!', '...it is not the spoon that bends, it is only yourself.', 'at last, something I can recommend', 'The world of computers', 'Welcome to the Real World.', 'Matrix - one of the greatest ever - in same league as The Shawshank Redemption & Interstellar', 'What is the Matrix? Well, one of the best films ever, for one thing...', 'The benchmark for all sci-fi films to come', 'Wow! I Finally Saw It!', 'Almost my favorite movie ever! The metaphors/quotes should be more known!']"
Goodfellas,"['In one word: perfection', ""An Offer You Can't Refuse..."", 'The best mobster film ever made', 'A great director at the peak of his talents', 'One word: priceless', 'The greatest mob film still today', 'The Definitive Film of the 1990s', 'The Criminal Mindset', ""Simply a masterpiece. Scorsese's last truly great movie (to date)."", 'The Mob...Revealed', ""Martin Scorsese's masterpiece."", 'A classic. Durp.', 'Aged like a fine wine', 'Slightly disappointed but still very good', 'Iconic', ""Scorsese's best"", ""As good as those fellas are...I just don't get it"", 'Instant classic', 'A classic mobster film.', 'Classic modern day gangster film', ""Scorsese's masterpiece stands the test of time"", 'Italian Storytelling', 'Rightfully hailed as one of the greatest gangster epics of all time', 'A Masterpiece That Gets Better With Each New Viewing', 'Slick, flashy, often brilliant, yet cannot make you give a hoot about its characters']"
One Flew Over the Cuckoo's Nest,"['The spirit of freedom vs. the spirit of legal-ism', 'Both uplifting and disheartening, sometimes both at once', 'Touching and moving, a great cinematic experience', '""What an excellent movie"" is all that went through my mind after seeing this masterpiece', 'A masterpiece', ""Poetic - Powerful - Simple: The Greatness of Cuckoo's Nest."", 'Jack Nicholson at his finest', 'Jack Nicholson Finally Wins the Oscar', 'Best film of its era', 'One of the greatest of all time.', 'A great order vs. chaos tale that everyone can relate to', 'A perfect mixture of entertainment and drama.', 'You have to be crazy to hate this movie! This movie is a masterpiece', 'Extraordinary', ""It's not that easy"", 'The Ultimate Backfire', 'One Flew Over One of the Best Movies Ever Made!!! (And that person was me)', 'Cool Hand Jack', 'One of the Greatest Ever Made', 'Get Mad If You Want To! This Is Very Realistic!', 'One of the Last Anti-Establishment Films of the 1970s', 'Storytelling that Imprisons', 'Now I know why they closed?', 'A wonderful film', ""I'm not stuck in here with you, you're stuck in here with me!""]"
Se7en,"[""Very grim and disturbing but you can't stop watching"", 'A brilliant postmodern film noir that is grim, intelligent and disturbing', 'Still manages to astound after 20 years of repeat viewings', 'Dark and disturbing thriller that will stay with you for ever.', ""He's experienced about as much pain and suffering as anyone I've encountered, give or take, and he still has Hell to look forward to."", 'An out and out classic.', 'Probably the greatest murder story ever', 'A dark and disturbing masterpiece.', 'one of the best-made films of its era and genre', 'Top Serial Killer Movie', 'Modern Masterpiece!!', 'Stand out Thriller thanks to Fine Cast.', 'Superbly crafted drama delves into darkest corners of the psyche', ""Simply one of the darkest and best thrillers of the 1990's \x96 but don't let anyone spoil it for you....."", 'David Fincher Strikes Again, With An Unwavering Thriller That Strikes Straight To The Heart', ""Se7en gruesome chapters of a killer's manifesto..."", '20+ years later, I watched it again', 'Fincher At His Finest!', 'One Of The Greatest Thrillers Of All-Time', '""This isn\'t going to have a happy ending.""', 'beautiful darkness', 'Se7en is a Sinfully Enthralling Thriller!', 'With over 900 reviews, mine is hardly necessary : ) Blu-ray: Excellent A:10 V:10', ""Fincher's Se7en is a classic crime story which can rival the likes of Silence of the Lambs"", 'Dark, grisly, and highly intelligent edge-of-your-seat thriller']"
It's a Wonderful Life,"['""To My Big Brother George, The Richest Man In Town""', 'A Great Influence...', 'One of those quintessential Christmas movies....', 'A Wonderful Film and Timeless Classic', 'A wonderful film that should be watched again and again.', 'Best feel good movie ever? Quite possibly.', ""It's a Wonderful Life"", 'Atop my Top Ten', 'Who are you, really?', ""IT'S NOT OFFICIALLY CHRISTMAS SEASON UNTIL I WATCH THIS MOVIE"", 'One of the greatest movie ever made in cinema history!!', 'So is the movie...', '""Each man\'s life touches so many other lives"".', ""It just doesn't age"", 'Great Christmas (and all year round) movie', 'One of the Most Beautiful Movies of the Cinema History Ever', 'Enjoyable, hearty and well crafted', 'Magical.', ""Each man's life touches so many others."", ""A movie that you can't help but feel good from!"", 'Sheer brilliance!', ""FRANK CAPRA'S OPUS"", 'No man is a failure who has friends', 'A wonderful experience', 'More than ""a Christmas film""...']"
Interstellar,"['Out of this world', 'A visual and auditory marvel', 'Masterpiece', 'Possibly the best movie of all time', 'I waited 5 years to watch it again', 'Masterpiece', '7 years later', 'A journey across the galaxy to save humanity', 'Excellent Movie', 'I would rate 11/10', 'Absolutely Brilliant', 'A Sci-Fi Masterpiece', 'A Visually Monumental And Thoughtful Sci-Fi Epic', 'Greatest movie of all time', 'An Emotional, Beautiful Journey into the Unknown', 'Fascinating Film', 'A visual masterpiece.', 'Interstellar : An open-hearted & mastered Human Odyssey', 'Maybe the most spectacular movie of 2014 and one of the best', ""time travel= relativity =space equilibrium= Nolan's grand space masterpiece"", 'An amazing Drama with Sci-Fi elements.', 'Best movie I have seen in my life', 'Going brilliantly (but very LOUDLY) into the dark', ""Glad i didn't watch the trailer"", ""I've never seen a movie so good in a long time""]"
Seven Samurai,"['Solid Gold', 'Story-Telling At Its Finest', ""Kurosawa's triumphant epic- totally & successfully driven by character and story"", 'Memorable characters and one of the best action movies of all times', 'Arguably, the best samurai film ever made', 'Kurosawa is the greatest director that ever lived', 'Required Viewing', 'Shichinin no samurai: Simply outstanding', ""Haven't you seen it yet?"", 'A cinematic masterpiece', ""Akira Kurosawa's 'Seven Samurai': A Timeless Masterpiece of Cinema"", 'Ahead of its time.', 'Long and sometimes hard to follow.', 'Awesome', 'Complex Beauty', 'Ronin the countryside.', 'One of the Best Movies of Cinema History', 'A really great epic film, beautifully told with stunning acting', 'This film can be described in one word...Awesome!!', 'A Solid Defense of Art', ""Kurasawa's best film"", 'Brilliant composition plus brilliant acting = brilliant flawless movie!', 'One of the most influential in movie history', 'Best non-English film ever!!!', 'Iconic influential movie']"
The Silence of the Lambs,"['As good as its notorious reputation suggests.', ""Dr.Lecter, I'd like to see you again..."", 'Rare to experience a dark n twisted thriller aided by top notch performances, tight script n direction.', 'In a Class by Itself', ""A Story And A Character That You Can't Forget"", '""The Godfather"" of all thrillers', 'A Grand Thriller', 'A rare contender for the best film of all time', 'A thrilling must see', 'A truly remarkable film', 'Perfectly executed dramatic thriller', 'Class Act', 'Absolutely Brilliant.', 'Truly enthralling film and not one to forget', 'Very Effective Thriller But Ultimately Overrated', 'Some Careless Stitching', 'Classic psychological, suspense brilliant - masterpiece best horror thriller ever made!', 'ONE OF THE BEST FILMS EVER MADE! A MASTERPIECE!', 'The granddaddy of all serial killer flicks', '""I\'ll help you catch him, Clarice"".', 'A gripping film that well deserved its Oscars', 'Somewhat Silenced By Time', ""Suspenseful doesn't come close!"", 'Best served chilled with a nice Chianti', 'One of the Greatest Thrillers of all Time.']"
Saving Private Ryan,"['Hard to Rate ... been there', '""Sergeant, we have crossed some strange boundary here. Our world has taken a turn for the surreal"".', ""The only movie my grandfather couldn't finish"", ""A war film you simply can't miss."", 'War is hell, and ""Saving Private Ryan"" peeks into the gates of Hades', ""Everything you've heard is true"", ""Actually it's pretty GOOD history"", 'A strongly acted, powerful film that is unashamedly brutal!', 'I Agree: This Is The Best War Movie Ever Made', 'The most realistic harrowing battle scenes ever filmed...', 'This should cool off the Rambo wannabes', 'This is one of the greatest movies ever made.', 'Excellent despite some Spielberg slips into sentiment', 'One of the best war movies ever made', 'Horrors of War', 'Numbing experience of SPR redeems baby boomers...', 'One of the most outstanding movies ever', 'Breathtaking', ""One of Spielberg's Most Haunting and Visually Stunning Films"", 'The Greatest War Movie Ever Made', 'Best movie of world war two', 'One of the best war films ever made.', ""WWII Films Don't Get Much Better"", 'Fictional yes but combat authenticity was genuinely real.', 'amazing battle scenes, subpar story']"
City of God,"['A Brazilian masterwork', 'Gangs of Rio', 'Stunning - in every sense of the word', 'Magnificent, gut-wrenching and utterly compelling', 'Shocking, Stylish & Brutal Story', 'The Godfather of Rio', ""It's a masterpiece."", 'One of the best unseen foreign films', 'Down and dirty', 'Cidade De Deus', 'Raw and cult film', 'One of my top 10', 'The Other (Sad) Side of the Wonderful City of Rio de Janeiro', 'Sprawling crime masterwork from Brazil', 'The Best Film Ever Made', '""One of the best films you\'ll ever see!""--Roger Ebert, does it live up to the hype?', 'An unsparing portrait of a sociopathic generation', 'Phenomenal', 'Almost Too Much to Watch', 'City of God was Incredible', 'Excellent and violent film based on real events', ""In terms of movie-making, there's nothing like it."", 'a horrible movie that I strongly recommend', 'Easily my favourite movie of all time!', 'The gangs of Rio']"
Life Is Beautiful,"['Love is Beautiful...', 'Funny, entertaining, and amazingly intense and dramatic.', 'Outstanding', 'funny and disturbing', 'An excellent war movie!', 'A satire set in a concentration camp, tough a hit internationally, was thought by some critics to be in bad taste...', 'One of the best movies ever.', 'A superb tragi-comedy', 'The most aptly named movie - A classic', 'A Movie About Hope', 'A very moving, powerful War film.', ""The Best Movie I've seen for a long long time"", 'The best foreign language film I have ever seen.', 'Visually stunning, but uneven. For me the second half was better than the first', 'Roberto Benigni is a GENIUS', ""One of the Best Movies I've Ever Seen"", 'A beautiful film... but not an entirely perfect one', 'Slapstick humor in a holocaust film?', 'Marvelous tale about a likable Jewish protecting his son and wife from horrifying concentration camp', '""Nothing is more necessary than the unnecessary"".', 'Courage Personified...10/10', 'Bon Giorno Principezza!!!!', 'Unlike Anything', ""Begnigni è Genio (Begnigni's a Genius)"", '""Those who find ugly meanings in beautiful things are corrupt without being charming. This is a fault."" (Oscar Wilde, preface to ""The Picture of Dorian Gray"")']"
The Green Mile,"['"" I knows you think I\'s a powerful man, but the darkness scares me boss ""', 'One of the most penetrating films of the past several years. **** out of ****', ""'m sorry for what I am"", 'The Least Of us', 'An incredible movie.', 'Do not live your entire life without seeing this film!!!', 'A one of a kind classic', 'Like the drink only not spelled the same', 'this movie can tear emotions out of anyone.', 'Great', 'Mixing an emotional drama with a Miracle!', 'A rare gem of casting and direction.', 'As wonderful as the book!', 'Rest in Peace Michael Clarke Duncan', 'True to the book, which is odd for a movie.', 'Rest In Peace, Michael Clarke Duncan, you legend.', 'Warning to Teamsters: Bring 5 Hankies', 'It will stay with you for a long time.', ""This movie blew me away, made me laugh, made me cry and me truly understand what the term 'sad' meant"", 'Film was invented for creations like this.', 'Overlong, but haunting, thought-provoking, moving and engrossing', 'Supernatural prison drama is a feather in the cap for all involved', 'Another period prison based Darabont masterpiece!', 'Amazing and captivating rendition of the novel.', ""Should be higher in top 250. One of those movies which makes you cry and admire creator's mind. True Masterpiece""]"
Terminator 2: Judgment Day,"['Note to Hollywood: This is how you make an action film.', 'Movie that everyone should see!', 'This is the sequel that dreams are made of.', 'Hasta la vista baby', 'This Terminator Sequel, may prove to be the best sequel ever made.', ""He Said He'd Be Back...and He Certainly is!"", ""The best action sequel of all time and one of the best Schwarzenegger's movies my personal favorite"", 'Great', 'A bigger, richer sequel that is every bit as fantastic as its predecessor and even surpasses it in some areas', 'The purest form of action cinema there is', 'Awesome action sequences, terrific sound effects n superb cgi. The chase sequence is awesome.', 'surpasses the original', 'Great action and much more', 'Words cannot describe the greatness of this movie', 'One sequel that out does the original', 'THE Best Action Film Ever!', ""Schwarzenegger's Best Film, Hands Down"", 'It pushes the limits of greatness', ""There's a reason this is so appreciated"", 'Persistence Personified 2...', 'The most iconic Time Travel and AI Rebellion story with the greatest Action of all time.', 'the best action film of all time, and NOT due to the CGI', 'One of the best action sci fi movies ever made.', 'A blazing big-budget sci-fi thriller, very creative, to be entirely experienced...', 'The Best Movie Of All Time']"
Star Wars: Episode IV - A New Hope,"[""One of the most successful movies of all time (and I'm not talking about the Box Office take)"", 'A classics, phenomenal and arguably the best sci-fi flick masterpiece!', 'One for All & All for One...', 'The original version was brilliant...', 'A film that changed the industry forever.', 'Legendary piece of cinema', 'The Best of Sci-Fi Times,the Worst of sf Times', 'The classic...', 'The Force will be with you, always.', 'A milestone in film-making- a superlative sci-fi movie', 'The greatest cinematic epic of all time begins here.', 'Where It All Began-----10/10', 'In A Galaxy Far Away................A Franchise Was Born', 'A long time ago in a decade without CGI...', 'In 1977, in a galaxy far, far away...', ""Not just a great movie. It's important"", 'Never gets old', 'Cinema Classic', 'The Movie that Changed My Life Forever!', 'A Long, Long Wait For A Movie Far, Far Away', 'From the Lucasian Chair of Entertainment - a masterpiece', 'Just plain fun!', 'A long time ago in a childhood not too far away...', 'A great movie - for its time', 'the landmark space fantasy']"
Back to the Future,"['So good in so many ways', 'A Time -Travelling Classic', 'How could anything be more fun than this?', 'Great movie', 'A classic masterpiece the original the only best my favorite time travel film of all time', 'A film you can watch time and time again.', ""An '80s classic that never disappoints"", 'Gets Better With Age', 'Gotta get back in time! Get back Marty!', 'Huge fun.', 'Time Travel Movies Are Always Brilliant', 'Absolute Classic', 'Part 1-Goodness gracious! Great balls of fire!', 'adorable', 'Let your imagination fly', 'Great Scott! Back to the Future is a great time-travel movie!', 'The Lost Blockbuster', '1.21 giga watts of awesomeness', 'As close as you can get to a perfect movie', 'Typical 1980s Film That Still Delivers', 'You gotta come back with me...', 'Proof that Hollywood once was capable of putting magic on film', 'Best Part of a the Best Movie Ever', 'So Much Fun', 'Pure Genius']"
Spider-Man: Across the Spider-Verse,"['One Step Above Masterpiece!', 'Masterful IMAX Spider-Man', 'One of the best sequels to anything ever made', 'A new Empire Strikes Back', 'Okay This Is Peak', 'My feelings about this sequel are currently glitching', 'My movie of 2023 so far.', ""It's good, but I still like the first one better. (7.5)"", 'This is one of the most overhyped movies I have ever watched.', 'Perhaps not for everyone.', 'Across the Universe Of Fun, Excellence, and Adventure: Spider-Man Makes A Connected Web Of Wow', 'Wanted to Love it, But Just Liked it', 'the greatest spider-man film ever.', 'So Overhyped That I Felt Disappointed', 'Decent, nowhere as good as the first', 'The multiverse has opened the doors to the Spiderverse', 'Perfect', 'Half of a movie', 'Slow, overlong, and cliched', 'Many theater goers walked out before ending', 'Disappointing', 'Wow, just WOW!', 'Audible groan from the cinema when it finished', 'I Was Bored To Death!', 'Spider-man: Middle of the Spider-Verse']"
Spirited Away,"['Strange, touching and beautiful', 'a minority dissenting view', ""I don't really know what to say."", 'Best animated film I have seen!', 'An Amazing Achievement in Animation.', 'Exceptional, but perhaps not so much for the casual viewer', 'A stunning, intoxicating, magical masterpiece', 'Great', 'Dub or sub?', ""I'm so confused..."", 'Over-Appreciated', ""I just didn't fully get it"", 'One of the Greatest Movies Of All Time', 'The audience is even more interesting than the film', 'A Fantastic Film (most literally)', 'better than Disney by a long shot', 'Prepare to be enchanted!', 'I have no strong opinion about this movie either way', ""Even if anime isn't your thing, this is a very rewarding movie."", 'A childhood classic', 'I disagree with Gazzer-2', 'Not for me I guess', '""Finish what you started, Human.""', 'Weird and massively over rated', ""I can't speak for the original or sub, but the dubbed version is a bad movie""]"
The Pianist,"['Excellent, depressing, but excellent', 'A Masterpiece. Awesome acting by Brody.', ""A haunting film, one that you won't forget"", 'An astonishing film', 'To hell and back.', '""You musicians don\'t make good conspirators.""', 'Stoic, haunting tale of survival', ""Adrien Brody's Minimalist Acting Packs Maximum Emotional Punch"", 'Definitively an inspiring epic...', 'terrific movie, if relentlessly gritty and realistic', '10 out of 10', 'Tour de Force', 'Heartfelt and enthralling', 'Haunting masterpiece that you may only be able to watch once..', 'Brilliantly Narrated, Visually Stunning!', 'Survivor', 'Lacks a bit of character development and not as powerful as I expected it to be', 'Warsaw Fact...', 'Unforgettable', 'Adrien Brody at his best. A True heartbreaking story!', ""It's a captivating film."", 'Good, but imdb voters are overrating it', 'Spilzman? What a beautiful name for a pianist...', '6.3/10 - Wanted to Like This More', 'Intense biography about a Polish pianist named Szpilman during the Warsaw ghetto']"
